{
	"cluster" : {
		"address" : "CLUSTER_ADDRESS",
        "port" : "8000",
		"username" : "", 
		"password" : "",
        "access_token": ""
	},
    "influxdb" : {
        "address" : "INFLUXDB ADRESS",
        "token" : "INFLUXDB_TOKEN",
	"bucket_name" : "BUCKET_NAME",
	"org_name" : "ORG_NAME"
    },
    "email":{
        "from": "from@mail.com",
        "to": "to@mail.com",
        "login": "",
        "password": "",
        "server": "SMTP SERVER ADDRESS",
        "port": 25,
        "use": "none"
    },
    "directories": {
        "dir_paths": ["/Dir1","/Dir2"],
        "max_depth": 0
    }
}
